{
  "$schema": "https://json-schema.org/draft/2020-12/schema",
  "$id": "https://openchecklists.net/schema/open-checklist-log-1.0.schema.json",
  "title": "Open Checklist Completion Log",
  "description": "A record that a checklist was worked through: what was ticked, when, by whom, and against which exact version of which checklist. Separate from the checklist itself because a checklist is a document and a log is an event. Designed so that an honest log is easy to produce and a dishonest one is hard to produce accidentally.",
  "type": "object",
  "required": [
    "open_checklist_log_version",
    "id",
    "checklist",
    "session",
    "recording",
    "entries"
  ],
  "additionalProperties": false,

  "properties": {
    "open_checklist_log_version": { "type": "string", "const": "1.0" },

    "id": {
      "description": "Unique identifier for this log entry. A UUID or any collision-resistant string.",
      "type": "string",
      "minLength": 8,
      "maxLength": 100
    },

    "checklist": {
      "description": "Exactly which checklist was used. The content hash is the point of this block: without it, a log says only that the pilot ticked something called 'Cessna 172N Preflight', which is not evidence of anything six months later.",
      "type": "object",
      "required": ["id", "content_hash"],
      "additionalProperties": false,
      "properties": {
        "id": { "type": "string", "maxLength": 100 },
        "title": { "type": "string", "maxLength": 200 },
        "file_revision": { "type": "string", "maxLength": 50 },
        "content_hash": {
          "description": "SHA-256 of the canonical serialization of the checklist file, excluding its verification block. Proves which version was in the pilot's hand.",
          "type": "string",
          "pattern": "^[a-f0-9]{64}$"
        },
        "source_url": { "type": "string", "format": "uri" },
        "verification_at_use": {
          "description": "The checklist's verification state at the time it was used. Copied into the log because the corpus state can change afterwards, and what matters is what the pilot was relying on.",
          "type": "object",
          "additionalProperties": false,
          "properties": {
            "source_fidelity": { "type": "string", "maxLength": 40 },
            "operational_review": { "type": "string", "maxLength": 40 },
            "completeness": { "type": "string", "maxLength": 40 }
          }
        }
      }
    },

    "aircraft": {
      "type": "object",
      "additionalProperties": false,
      "properties": {
        "registration": { "type": "string", "maxLength": 20 },
        "make": { "type": "string", "maxLength": 100 },
        "model": { "type": "string", "maxLength": 100 },
        "hobbs_start": { "type": "number", "minimum": 0 },
        "tach_start": { "type": "number", "minimum": 0 }
      }
    },

    "pilot": {
      "type": "object",
      "additionalProperties": false,
      "properties": {
        "name": { "type": "string", "maxLength": 200 },
        "identifier": {
          "description": "Certificate number, student id, or club member number. Free text; never validated by the project.",
          "type": "string",
          "maxLength": 100
        },
        "role": { "enum": ["pilot_in_command", "student", "second_in_command", "instructor", "mechanic", "owner"] }
      }
    },

    "session": {
      "type": "object",
      "required": ["started"],
      "additionalProperties": false,
      "properties": {
        "started": {
          "description": "When the pilot began working the checklist. RFC 3339 with an explicit offset; a local time with no offset is not evidence of when anything happened.",
          "type": "string",
          "format": "date-time"
        },
        "finished": { "type": "string", "format": "date-time" },
        "location": {
          "type": "object",
          "additionalProperties": false,
          "properties": {
            "airport": { "type": "string", "maxLength": 20 },
            "description": { "type": "string", "maxLength": 200 },
            "latitude": { "type": "number", "minimum": -90, "maximum": 90 },
            "longitude": { "type": "number", "minimum": -180, "maximum": 180 },
            "position_source": { "enum": ["device_gps", "manual_entry", "none"] }
          }
        },
        "outcome": {
          "description": "How the session ended. 'abandoned' and 'aircraft_rejected' are first-class outcomes: a preflight that found a problem and stopped is the system working, and a log format that can only record success quietly pressures people to record success.",
          "enum": ["completed", "completed_with_discrepancies", "abandoned", "aircraft_rejected", "in_progress"]
        }
      }
    },

    "recording": {
      "description": "How this log came to exist. The most important block for whether the log is worth anything, and the one most likely to be quietly wrong.",
      "type": "object",
      "required": ["mode"],
      "additionalProperties": false,
      "properties": {
        "mode": {
          "description": "live = each item was marked at the moment it was done, timestamps generated by the device. retrospective = entered after the fact from memory. mixed = some of each. A retrospective log is still useful as a record of intent, but it is not evidence about timing and must never be presented as if it were.",
          "enum": ["live", "retrospective", "mixed"]
        },
        "device": { "type": "string", "maxLength": 200 },
        "app": { "type": "string", "maxLength": 100 },
        "app_version": { "type": "string", "maxLength": 50 },
        "clock_source": {
          "description": "Where timestamps came from. A device clock the user can set is not a trusted time source, and saying so is more honest than implying otherwise.",
          "enum": ["device_clock", "network_time", "gnss", "unknown"]
        },
        "edited_after_completion": {
          "description": "True if any entry was changed after the session finished. Set by tooling, never by the user, and never resettable to false.",
          "type": "boolean",
          "default": false
        }
      }
    },

    "entries": {
      "description": "One record per checklist item the pilot interacted with. Items that are not tickable (notes, cautions, warnings) may appear with state 'acknowledged' but must never appear as 'completed', because they were never tasks.",
      "type": "array",
      "minItems": 1,
      "items": {
        "type": "object",
        "required": ["section_id", "item_index", "state"],
        "additionalProperties": false,
        "properties": {
          "section_id": { "type": "string", "maxLength": 60 },
          "item_id": {
            "description": "The item's stable id where it has one. Preferred over item_index, which shifts if the checklist is edited.",
            "type": "string",
            "maxLength": 60
          },
          "item_index": { "type": "integer", "minimum": 0 },
          "item_text": {
            "description": "The item text as shown to the pilot. Denormalised deliberately: a log that only holds indices becomes unreadable if the checklist file changes or disappears.",
            "type": "string",
            "maxLength": 2000
          },
          "state": {
            "description": "completed = done as written. skipped = deliberately not done. not_applicable = does not apply to this aircraft or flight. deferred = to be done later in the sequence. failed = attempted and the aircraft did not comply. acknowledged = an information item the pilot marked as read.",
            "enum": ["completed", "skipped", "not_applicable", "deferred", "failed", "acknowledged"]
          },
          "at": { "type": "string", "format": "date-time" },
          "note": { "type": "string", "maxLength": 1000 },
          "reason": {
            "description": "Required for skipped and failed. An unexplained skip is the thing a reviewer, instructor, or investigator will ask about first, so the format asks at the time instead.",
            "type": "string",
            "maxLength": 1000
          },
          "observed_value": {
            "description": "What was actually read, where the item calls for a value. This is what turns a tick into a record: 'fuel checked' is an assertion, '18.5 gal' is an observation.",
            "type": "object",
            "additionalProperties": false,
            "properties": {
              "value": { "type": ["number", "string"] },
              "unit": { "type": "string", "maxLength": 20 }
            }
          }
        },
        "allOf": [
          {
            "comment": "A skip or a failure without a stated reason is the gap that makes a log useless in review.",
            "if": { "properties": { "state": { "enum": ["skipped", "failed"] } }, "required": ["state"] },
            "then": { "required": ["reason"] }
          },
          {
            "comment": "A live log must timestamp every entry; that is what distinguishes it from a retrospective one.",
            "if": { "properties": { "state": { "const": "completed" } }, "required": ["state"] },
            "then": { "anyOf": [{ "required": ["at"] }, { "required": ["item_text"] }] }
          }
        ]
      }
    },

    "discrepancies": {
      "description": "Squawks found during the check. The operationally valuable output of a preflight, and the reason a log is worth keeping even when nobody ever audits it.",
      "type": "array",
      "items": {
        "type": "object",
        "required": ["description", "disposition"],
        "additionalProperties": false,
        "properties": {
          "description": { "type": "string", "minLength": 1, "maxLength": 1000 },
          "section_id": { "type": "string", "maxLength": 60 },
          "item_id": { "type": "string", "maxLength": 60 },
          "severity": { "enum": ["grounding", "requires_maintenance", "monitor", "cosmetic"] },
          "disposition": {
            "description": "What the pilot did about it. 'flown_anyway' exists because it happens, and a format that cannot record it produces logs that are quietly false.",
            "enum": ["aircraft_grounded", "reported_to_maintenance", "deferred_per_mel", "corrected_before_flight", "flown_anyway"]
          },
          "reported_to": { "type": "string", "maxLength": 200 },
          "photo_ref": { "type": "string", "maxLength": 300 }
        }
      }
    },

    "attestation": {
      "description": "The pilot's statement about this log. Optional, and deliberately not a legal instrument: it records that a named person stands behind the record.",
      "type": "object",
      "required": ["statement", "by", "at"],
      "additionalProperties": false,
      "properties": {
        "statement": { "type": "string", "minLength": 1, "maxLength": 2000 },
        "by": { "type": "string", "minLength": 1, "maxLength": 200 },
        "at": { "type": "string", "format": "date-time" },
        "signature": {
          "type": "object",
          "additionalProperties": false,
          "properties": {
            "algorithm": { "type": "string", "maxLength": 50 },
            "public_key": { "type": "string", "maxLength": 2000 },
            "value": { "type": "string", "maxLength": 4000 }
          }
        }
      }
    },

    "previous_log_hash": {
      "description": "SHA-256 of the pilot's previous log, forming a hash chain. Makes a log series append-only in practice: removing or backdating one entry breaks every later link. Cheap to implement and the only mechanism here that resists after-the-fact tidying.",
      "type": "string",
      "pattern": "^[a-f0-9]{64}$"
    },

    "extensions": {
      "type": "object",
      "propertyNames": { "pattern": "^[a-z0-9-]+\\.[a-z0-9_.-]+$" }
    }
  },

  "allOf": [
    {
      "comment": "A live recording claims device-generated timestamps, so the session must have a finish time once it is not in progress.",
      "if": {
        "properties": {
          "recording": { "properties": { "mode": { "const": "live" } }, "required": ["mode"] },
          "session": { "properties": { "outcome": { "not": { "const": "in_progress" } } }, "required": ["outcome"] }
        },
        "required": ["recording", "session"]
      },
      "then": { "properties": { "session": { "required": ["finished"] } } }
    },
    {
      "comment": "Recording discrepancies but claiming a clean completion is contradictory.",
      "if": { "required": ["discrepancies"], "properties": { "discrepancies": { "minItems": 1 } } },
      "then": {
        "properties": {
          "session": {
            "properties": { "outcome": { "not": { "const": "completed" } } }
          }
        }
      }
    }
  ]
}
