{
  "open_checklist_log_version": "1.0",
  "id": "log-example-20260714-134210-kfdk",
  "checklist": {
    "id": "faa-generic-sep-ground-operations",
    "title": "Generic Single-Engine Piston — Ground Operations (FAA Airplane Flying Handbook)",
    "content_hash": "b9185db02f250a23fc68da70577262de0d6d318ef3cb5fc6f8ef149088d76614",
    "file_revision": "0.1.0",
    "verification_at_use": {
      "source_fidelity": "unreviewed",
      "operational_review": "none",
      "completeness": "partial"
    }
  },
  "aircraft": {
    "registration": "N734XY",
    "make": "Cessna",
    "model": "172N",
    "hobbs_start": 4218.6
  },
  "pilot": {
    "name": "Example Pilot",
    "role": "pilot_in_command"
  },
  "session": {
    "started": "2026-07-14T13:42:10-05:00",
    "finished": "2026-07-14T13:45:33-05:00",
    "location": {
      "airport": "KFDK",
      "position_source": "manual_entry"
    },
    "outcome": "completed_with_discrepancies"
  },
  "recording": {
    "mode": "live",
    "device": "Pixel 8",
    "app": "open-checklists render.py",
    "app_version": "0.1.0",
    "clock_source": "network_time",
    "edited_after_completion": false
  },
  "entries": [
    {
      "section_id": "taxi",
      "item_index": 1,
      "item_text": "Airspeed indicator",
      "state": "completed",
      "at": "2026-07-14T13:42:10-05:00"
    },
    {
      "section_id": "taxi",
      "item_index": 2,
      "item_text": "Attitude indicator",
      "state": "completed",
      "at": "2026-07-14T13:42:16-05:00"
    },
    {
      "section_id": "taxi",
      "item_index": 3,
      "item_text": "Altimeter",
      "state": "completed",
      "at": "2026-07-14T13:42:21-05:00"
    },
    {
      "section_id": "taxi",
      "item_index": 4,
      "item_text": "Turn indicator",
      "state": "completed",
      "at": "2026-07-14T13:42:28-05:00"
    },
    {
      "section_id": "taxi",
      "item_index": 5,
      "item_text": "Directional gyro",
      "state": "completed",
      "at": "2026-07-14T13:42:34-05:00"
    },
    {
      "section_id": "taxi",
      "item_index": 6,
      "item_text": "Vertical speed indicator",
      "state": "completed",
      "at": "2026-07-14T13:42:43-05:00"
    },
    {
      "section_id": "before-takeoff",
      "item_index": 3,
      "item_text": "Allow the airplane to roll forward slightly to align the nosewheel or tailwheel with the longitudinal axis",
      "state": "completed",
      "at": "2026-07-14T13:42:47-05:00"
    },
    {
      "section_id": "before-takeoff",
      "item_index": 4,
      "item_text": "Oil temperature",
      "state": "completed",
      "at": "2026-07-14T13:42:58-05:00"
    },
    {
      "section_id": "before-takeoff",
      "item_index": 6,
      "item_text": "Fuel system",
      "state": "completed",
      "at": "2026-07-14T13:43:12-05:00"
    },
    {
      "section_id": "before-takeoff",
      "item_index": 7,
      "item_text": "Trim",
      "state": "completed",
      "at": "2026-07-14T13:43:20-05:00"
    },
    {
      "section_id": "before-takeoff",
      "item_index": 8,
      "item_text": "Flight controls",
      "state": "completed",
      "at": "2026-07-14T13:43:27-05:00"
    },
    {
      "section_id": "before-takeoff",
      "item_index": 9,
      "item_text": "Engine operation",
      "state": "completed",
      "at": "2026-07-14T13:43:39-05:00"
    },
    {
      "section_id": "before-takeoff",
      "item_index": 10,
      "item_text": "Electrical system",
      "state": "completed",
      "at": "2026-07-14T13:44:01-05:00"
    },
    {
      "section_id": "before-takeoff",
      "item_index": 12,
      "item_text": "Flight instruments",
      "state": "completed",
      "at": "2026-07-14T13:44:10-05:00"
    },
    {
      "section_id": "before-takeoff",
      "item_index": 13,
      "item_text": "Avionics",
      "state": "completed",
      "at": "2026-07-14T13:44:20-05:00"
    },
    {
      "section_id": "before-takeoff",
      "item_index": 14,
      "item_text": "Takeoff briefing",
      "state": "completed",
      "at": "2026-07-14T13:44:28-05:00"
    },
    {
      "section_id": "takeoff-checks",
      "item_index": 0,
      "item_text": "Runway numbers vs. magnetic compass and heading indicator",
      "state": "completed",
      "at": "2026-07-14T13:44:54-05:00"
    },
    {
      "section_id": "takeoff-checks",
      "item_index": 1,
      "item_text": "Doors and windows",
      "state": "completed",
      "at": "2026-07-14T13:45:00-05:00"
    },
    {
      "section_id": "takeoff-checks",
      "item_index": 2,
      "item_text": "Controls",
      "state": "completed",
      "at": "2026-07-14T13:45:05-05:00"
    },
    {
      "section_id": "takeoff-checks",
      "item_index": 3,
      "item_text": "Power",
      "state": "completed",
      "at": "2026-07-14T13:45:09-05:00"
    },
    {
      "section_id": "takeoff-checks",
      "item_index": 4,
      "item_text": "Engine RPM",
      "state": "completed",
      "at": "2026-07-14T13:45:13-05:00"
    },
    {
      "section_id": "takeoff-checks",
      "item_index": 5,
      "item_text": "Engine",
      "state": "completed",
      "at": "2026-07-14T13:45:18-05:00"
    },
    {
      "section_id": "takeoff-checks",
      "item_index": 6,
      "item_text": "Engine instruments",
      "state": "completed",
      "at": "2026-07-14T13:45:22-05:00"
    },
    {
      "section_id": "before-takeoff",
      "item_index": 11,
      "item_text": "Vacuum system",
      "state": "not_applicable",
      "at": "2026-07-14T13:45:28-05:00",
      "reason": "No vacuum system fitted; all-electric instruments."
    }
  ],
  "discrepancies": [
    {
      "description": "Left main tire wear near the cord on the inboard shoulder.",
      "section_id": "before-takeoff",
      "severity": "requires_maintenance",
      "disposition": "reported_to_maintenance",
      "reported_to": "Club maintenance officer"
    }
  ],
  "attestation": {
    "statement": "I performed each item recorded above at the time shown, on the aircraft named, and reported the discrepancy noted.",
    "by": "Example Pilot",
    "at": "2026-07-14T13:45:33-05:00"
  }
}
